{
  "$schema": "./validated-text.schema.json",
  "scope": "homepage",
  "description": "Sign-off copy for the public homepage (/). Structured like en.json / fr.json — one namespace per section.",
  "branding": {
    "registryName": "Mauritius AI Registry",
    "portalDomain": "airegistry.mu",
    "jurisdictionDisplay": "Mauritius"
  },
  "literals": {
    "en": {
      "trustAndIntegrate": "trust and integrate",
      "localLanguageSnippet": "Local language",
      "faq3Snippet": "What does",
      "heroHeadlineSuffix": "AI Registry"
    },
    "fr": {
      "trustAndIntegrate": "faire confiance et intégrer",
      "localLanguageSnippet": "Langue et culture",
      "faq3Snippet": "Que signifie",
      "heroHeadlineSuffix": "Registre IA"
    }
  },
  "en": {
    "nav": {
      "home": "Home",
      "registry": "Registry",
      "providers": "Providers",
      "contact": "Contact",
      "logIn": "Log In",
      "logOut": "Log Out",
      "switchTheme": "Switch to {theme} theme",
      "openMenu": "Open menu",
      "closeMenu": "Close menu",
      "adminPortal": "Admin Portal",
      "providerPortal": "Provider Portal",
      "verifierPortal": "Verifier Portal",
      "sovereignPortal": "Sovereign Portal",
      "accountSettings": "Account settings",
      "roleAdmin": "admin",
      "roleProvider": "provider",
      "roleVerifier": "verifier",
      "roleSovereign": "sovereign"
    },
    "footer": {
      "product": "Product",
      "resources": "Resources",
      "providers": "Providers",
      "governance": "Governance",
      "legal": "Legal",
      "registry": "Registry",
      "ecosystem": "Ecosystem",
      "documentation": "Documentation",
      "whitepaper": "Whitepaper",
      "openData": "Open data",
      "referenceImpl": "Reference impl",
      "sovereigntyRubric": "Sovereignty rubric",
      "verificationProofs": "Verification proofs",
      "pricingFree": "Pricing (free)",
      "charter": "Charter",
      "reviewBoard": "Review board",
      "appeals": "Appeals",
      "termsOfUse": "Terms of use",
      "privacy": "Privacy",
      "acceptableUse": "Acceptable use",
      "licenseApache": "License (Apache-2.0)",
      "contact": "Contact",
      "brandDescription": "Open-source infrastructure for sovereign AI discovery. The registry points; the provider operates; the hosting environment secures.",
      "providerPortal": "Provider portal"
    },
    "localeSwitcher": {
      "label": "Language",
      "chooseLanguage": "Choose language",
      "en": "English",
      "fr": "Français",
      "switchTo": "Switch to {language}"
    },
    "hero": {
      "subtitle": "Govern, orchestrate, and monitor trusted AI agents, models, and MCP infrastructure from a unified sovereign platform - built for nations, regulators, and the enterprises they depend on.",
      "exploreRegistry": "Explore Registry",
      "discoverEcosystem": "Discover Ecosystem",
      "verified": "Verified",
      "trusted": "Trusted",
      "active": "Active",
      "fallbackCard1Title": "MytGPT Enterprise",
      "fallbackCard1Subtitle": "Chat",
      "fallbackCard2Title": "my.t Vision AI",
      "fallbackCard2Subtitle": "Vision",
      "fallbackCard3Title": "my.t Document AI",
      "fallbackCard3Subtitle": "OCR",
      "fallbackAiResource": "AI resource"
    },
    "registrySection": {
      "eyebrow": "The Registry",
      "heading": "Discover what {jurisdiction} can <accent>trust and integrate</accent>.",
      "description": "The registry points to locally-relevant AI resources - never hosts them. Each listing carries a verifiable provider, a sovereignty review, and a stable AIR-ID under <mono>air://</mono>.",
      "showingCount": "Showing {count} of {total} public {total, plural, one {listing} other {listings}}.",
      "searchPlaceholder": "Search resources, providers, AIR-IDs…",
      "allResources": "All resources",
      "models": "Models",
      "agents": "Agents",
      "skills": "Skills",
      "model": "Model",
      "agent": "Agent",
      "skill": "Skill",
      "context": "Context",
      "latency": "Latency",
      "region": "Region",
      "license": "License",
      "loadingCatalogue": "Loading catalogue…",
      "noMatch": "No resources match these filters.",
      "errorLoad": "Could not load registry",
      "errorLoadMore": "Load more failed",
      "crumb": "Registry · Discover sovereign AI",
      "listPageSubtitle": "Browse public listings and filter by kind. Listings carry verifiable providers and stable AIR-IDs.",
      "viewDetails": "View details"
    },
    "whatGetsListed": {
      "eyebrow": "What gets listed",
      "heading": "Three resource types.",
      "headingAccent": "Composable by AI.",
      "description": "The registry covers three kinds of sovereign AI resource - models, agents and skills. Each has its own listing template and stable AIR-ID, so consumers and AI systems can find and combine them programmatically.",
      "modelEyebrow": "Type · Model",
      "modelTitle": "Models",
      "modelDesc": "Language, vision or domain models trained on or aware of local context, language and norms.",
      "agentEyebrow": "Type · Agent",
      "agentTitle": "Agents",
      "agentDesc": "Autonomous workflows that act on local processes - registrations, filings, public-service navigation.",
      "skillEyebrow": "Type · Skill",
      "skillTitle": "Skills",
      "skillDesc": "Packaged expertise - tax, legal, accounting workflows - ready to plug into agents."
    },
    "listingCriteria": {
      "eyebrow": "Listing criteria",
      "headingPrefix": "The",
      "headingAccent": "sovereignty test.",
      "description": "Only resources that meet a sovereignty test are listed past basic discovery. The test asks whether the resource encodes local law, local data, local systems, or local language and culture - keeping \"sovereign\" specific, not aspirational.",
      "howItWorks": "How it works",
      "howItWorksDesc": "A submission must cite at least one sovereignty basis and provide <highlight>concrete evidence</highlight>: a referenced law, dataset, institution, language asset or cultural artefact. Reviewers apply a published checklist before elevating a resource's status.",
      "qualityTitle": "Quality over quantity.",
      "qualityBody": "A registry of 50 credible resources is more useful than one of 1,000 generic listings. Small, deliberate, trustworthy - that's the bar.",
      "base1Name": "Local law",
      "base1Desc": "Encodes local legislation, regulation, official process or professional obligation.",
      "base2Name": "Local data",
      "base2Desc": "Uses local datasets, records or locally collected knowledge.",
      "base3Name": "Local systems",
      "base3Desc": "Integrates with or describes local institutional systems and workflows.",
      "base4Name": "Local language & culture",
      "base4Desc": "Supports local language, culture, norms or context."
    },
    "howItWorks": {
      "eyebrow": "How It Works",
      "heading": "From submission to use.",
      "headingAccent": "Six transparent steps.",
      "offRegistry": "off-registry · direct to provider",
      "step1Title": "Submit",
      "step1Desc": "Provider submits the resource with metadata and sovereignty evidence.",
      "step2Title": "Review",
      "step2Desc": "Reviewer applies the sovereignty rubric and records reviewer notes.",
      "step3Title": "Publish",
      "step3Desc": "Operator publishes the listing and issues the stable AIR-ID.",
      "step4Title": "Discover",
      "step4Desc": "Consumer finds the resource through the portal or discovery API.",
      "step5Title": "Use",
      "step5Desc": "Consumer calls the provider directly - runtime never touches the registry.",
      "step6Title": "Maintain",
      "step6Desc": "Provider keeps metadata accurate; status reflects any changes over time."
    },
    "promo": {
      "eyebrow": "Open for submissions",
      "fallbackHeading": "List your sovereign AI resource.",
      "fallbackBody": "You keep hosting, access, runtime identity, and liability. The registry just helps the right people find you. Submission is open and reviewed within 10 working days.",
      "fallbackCtaLabel": "Submit a Resource"
    },
    "faq": {
      "eyebrow": "FAQ",
      "heading": "Frequently asked questions",
      "faq1Q": "Does the registry host any AI?",
      "faq1A": "No. The registry only points. Providers operate their own resources, and hosting environments run the workloads. The registry is never on the runtime path.",
      "faq2Q": "How is sovereignty defined?",
      "faq2A": "A submission must cite at least one of: local law, local data, local systems, or local language and culture - with concrete evidence such as a referenced statute, dataset, or institutional integration.",
      "faq3Q": "What does \"verified\" mean?",
      "faq3A": "Provider verification confirms that the listing is bound to the rightful operator via DNS and email proofs. It does not imply endorsement of the resource itself.",
      "faq4Q": "Who can submit a resource?",
      "faq4A": "Any organisation or accredited individual that operates a sovereign AI resource can submit. Government endorsement is a separate, stronger signal granted only by the responsible authority.",
      "faq5Q": "Is the platform open source?",
      "faq5A": "Yes. The reference implementation at {portalDomain} and the AIR-SPEC are openly licensed. Each jurisdiction operates its own instance with local governance.",
      "faq6Q": "How are listings resolved at runtime?",
      "faq6A": "AIR-IDs (under air://) resolve to provider endpoints described in the listing metadata. Optionally, hosting environments issue SPIFFE/SPIRE SVIDs for runtime identity."
    }
  },
  "fr": {
    "nav": {
      "home": "Accueil",
      "registry": "Registre",
      "providers": "Fournisseurs",
      "contact": "Contact",
      "logIn": "Connexion",
      "logOut": "Déconnexion",
      "switchTheme": "Passer au thème {theme}",